sentiment,sentiment_count,sentiment_score,tweet_text,tweet_text_tmp
trust,4.0,2.0940000000000003,ATTENTION ALL ALLIES IF YOU CAN DONATE MONEY i am TRYING TO PUT TOGETHER MEDICAL SUPPLIES FOR THOSE OUT PROTESTING. #BlackLivesMatter You can send the money to me via PayPal lanac127 Cashapp lanac94 Any little amount you can donate helps the cause.,donate trying put protesting send donate helps 
trust,5.0,2.7739999999999996,"If you all going out tonight to protest, please share your location with someone and remain texting one friend. This shit is scary and the way it looks, shits just gonna get worse. PLEASE STAY SAFE YALL #BlackLivesMatter #WhereAreDCProtesters",going protest share remain texting looks shits gon get stay 
trust,5.0,2.641,"Bernie says ""demilitarize the police."" Biden says ""shoot them in the leg."" What a fucking glorious champion of black people Biden is, right? Someone give that man an MLK award! You get what you vote for. #BlackLivesMatter",says demilitarize says shoot fucking give get vote 
trust,5.0,2.438,"The media is all abuzz about the ""independent"" i will Topsey paid for by attorney Benjamin Crump that says that George Floyd was officiated. It was done by Michael Baden, who worked for Crump on Michael Brown, OJ Simpson, epstein is brother and affirmed single bill theory.",abuzz topsey paid says officiated done worked affirmed 
trust,4.0,2.3750000000000004,"We are deeply concerned about insufficient police accountability across the country, systemic racism, and inequities that have led to our protests born of despair, anger, and hope! VSU! I could not be more proud #NoJusticeNoPeace #BlackLivesMatter",led born hope 
trust,5.0,2.775,Volunteers from VA are lined up with countless others at a #BlackLivesMatter and vigil for #GeorgeFloyd. We may be 6' apart but we are tightly unified in our resolve to be effective allies. #VaLEG,lined 
trust,5.0,3.14,"Everybody has a role in fighting this pandemic. The Polar Movement now has protective mask available for preorder Affordably priced glasses friendly % of proceeds donated to UntilFreedom and George Floyd Stay strong, stay safe, and #DoYourPart to fight for justice!",has fighting has priced donated stay stay do fight 
trust,4.0,2.008,"We took a direct hit pepper bullets just before the president was speaking — Backpack with residue dust. we are safe now, as military vehicles are now in the streets of the nation is capital #BlackLivesMatter",took speaking 
trust,4.0,2.343,The President of the United States ordered law enforcement to tear gas completely peaceful protestors so that he could have a photo op at St. john is. What a joke! #DCProtests #WashingtonDCProtest #whitehouseprotest #BlackLivesMatter,ordered tear have 
trust,5.0,2.501,SO DID TRUMP JUST DECLARE MARTIAL LAW WITHOUT SAYING IT .... WHILE TEAR GASSING THE PROTESTERS IN FRONT OF THE WHITE HOUSE ... GOD PRAY FOR US #BlackLivesMatter #,declare saying tear gassing pray 
trust,7.0,3.438,"Asbury Park, NJ we showed up! About four thousand people came out in solidarity with the black community to demand #JusticeForGeorgeFloyd and an end to police brutality, white supremacy and racism! #BlackLivesMatter #ICantBreathe",showed came demand 
trust,5.0,2.298,"I was down at the White House with my fiance this evening, before curfew, peacefully protesting when the cops just started marching on protestors. It was scary and no one communicated what was happening. And it was for some garbage photo op. Black lives matter. #BlackLivesMatter",protesting started marching communicated happening 
trust,5.0,2.336,"Another day of peaceful protests met by violent police at the White House. Flash bangs, rubber bullets, pepper spray, batons, mounted police using their full force all well before curfew started #BlackLivesMatter #dcprotest #PoliceBrutality – at Lafayette Square Park",met mounted using started 
trust,6.0,2.72,"As an #Episcopal priest, I unequivocally condemn the display of militaristic white supremacy crap that just took place in front of St. john is Episcopal Church in Washington D.C. #BlackLivesMatter #protests2020 #vile",condemn took 
trust,6.0,3.3819999999999997,"The killing of George Floyd demands justice not a morally bankrupt president who takes pride in inflaming racial tensions, using the military to suppress peaceful protests and trampling our nation is fundamental principles of liberty and justice. #WashingtonDCProtest",demands takes inflaming using suppress trampling 
trust,4.0,1.9380000000000002,"Peaceful protest just 2 miles from here and this was 25 minutes before curfew. Tear gasing a peaceful crowd with children before curfew is f ared up. You set a rules, and you do not go by them, that is why people are standing up for themselves. #BlackLivesMatter #RVAprotests",tear gasing ared set go standing 
trust,4.0,2.117,"Had a peaceful protest today in Edgewater Park, NJ, my hometown. This is what our amazing police Lieutenant had to say. #blm #BlackLivesMatter #nj #newjersey #standtogether #icantbreathe #Peacefulprotest #cop #police",had had say 
trust,4.0,2.3360000000000003,The Police communicate exclusively with tear gas and intimidation. Is this how police should address the polis? #protests2020 #richmondprotest #RichmondRiot #BlackLivesMatter #JusticeForGeorgeFloyd – at Robert E. Lee Monument,communicate is address 
trust,4.0,2.3280000000000003,"Without action, our words are meaningless. KIPP DC schools will be closed tomorrow, Tues, June 2 in solidarity with our Black students, staff, and families. Please stay safe and take care of yourselves and each other. #BlackLivesMatter",closed stay take 
trust,6.0,3.688,"The murder of George Floyd is more proof that this was never a matter of evidence or truth. A video, that defines SO painstakingly what is wrong and right is STILL not enough to convince the majority of Americans that something here is gravely wrong.",defines convince 
trust,4.0,2.1710000000000003,"Extremely disappointed to see my high school care more about having an in-person graduation over the unjust criminal justice system. How hard would it have been to postpone the grad protest one or two days and acknowledge Monday is about Asbury, George Floyd social injustice?",see having been postpone acknowledge 
trust,7.0,3.806,"Do you agree with the following statement? The fact that the new autopsy paid for by the family of George Floyd was done by the man-Michael Baden-who also defended OJ Simpson, Michael Brown the JFK single bullet theory gives me more confidence in him.",agree following paid done defended gives 
trust,5.0,3.4770000000000003,The frustration and grief was palpable in the streets of #DC tonight. But so was the resolve and determination of a city committed to helping this country live up to its promise of #JusticeForAll. #DCProtests #BlackLivesMatter #JusticeForGeorgeFloyd,committed helping live 
trust,5.0,2.633,"*Im Safe* Tonight the people of Swann St NW showed us exactly what community looks like. When we said ""Black lives matter,"" they agreed. When we shouted ""who keeps us safe?"" The resounding response was, ""we keep us safe"" as they opened their homes to dozens of protesters.",showed looks said matter agreed shouted keeps was keep opened 
trust,6.0,3.016,"#SwannStreet has been liberated! Shoutout to everyone there who took a stand against police brutality and kept the focus on #BlackLivesMatter and #JusticeForGeorgeFloyd. Now time to #DivestfromMPD, an utter disgrace for DC. Follow and",liberated took kept follow 
trust,4.0,2.2880000000000003,"RIP #GeorgeFloyd RIP #AhmaudArbery RIP #TonyMcDade RIP #DavidMcAtee RIP #BreonnaTaylor RIP American democracy RIP American freedom First, rogue police officers declared war on us and then the president joined them",rip rip declared joined 
trust,4.0,2.1719999999999997,"This is why #BlackLivesMattter, matters. Until black lives matter, you can't, in good conscience, say All Lives Matter. Because they don't, not yet.",matters matter say 
trust,6.0,3.2569999999999997,Incredibly proud of my #DupontCircle neighbors who sheltered peaceful protesters in their homes last night from terrorizing police. #DupontStrong #BlackLivesMatter Those involved please file a complaint here:,sheltered terrorizing file 
trust,4.0,2.031,Police had protestors pinned with tear gas. Rahul Dubey let them into his hole for the night to escape police brutality. This man is a HERO. #BlackLivesMatter #dcprotest,had pinned let escape 
trust,6.0,3.2569999999999997,Incredibly proud of my #DupontCircle neighbors who sheltered peaceful protesters in their homes last night from terrorizing police. #DupontStrong #BlackLivesMatter Those involved please file a complaint here:,sheltered terrorizing file 
trust,6.0,3.2569999999999997,Incredibly proud of my #DupontCircle neighbors who sheltered peaceful protesters in their homes last night from terrorizing police. #DupontStrong #BlackLivesMatter Those involved please file a complaint here:,sheltered terrorizing file 
trust,4.0,2.282,i have been pretty silent on the TL because i have just been taking in information and trying to build a conscious understanding on everything...that does not mean I do not support. Black lives matter. Just because someone is not posting online does not mean they are not an ally.,taking trying build mean support posting mean 
trust,5.0,2.898,Here with Ward 5 neighbors to denounce trump is hate and to affirm that BLACK LIVES MATTER as he visits Saint John Paul II National Shrine. – at Basilica Of The National Shrine Of The Immaculate Conception,denounce hate affirm visits 
trust,7.0,3.867,i am not liking coverage of the George Floyd Memorial March at all. I spoke with them for 5 minutes sharing how I feel we can create change on a community to state level and they only highlighted the most white friendly/PG part of my piece. Share the whole truth.,liking spoke sharing feel create highlighted share 
trust,4.0,2.281,Video from this morning is protest outside of the Saint John Paul II National Shrine in Washington DC. Small crowd of about 200-300 protesters and ≈ three dozen officers. Opened at 11 am with a statement from #BlackLivesMatter #JusticeForGeorge – at Capuchin College,opened 
trust,3.0,2.399,People really keep talking about honoring George Floyd as if arresting the men that murdered him and respecting the lives of black folks everywhere would not be Honorable . Im perplexed,keep talking honoring arresting murdered respecting 
trust,3.0,1.992,We at Morris Animal Refuge are distraught by the events that have unfolded over the past week in our city and our country. We are heartbroken for the family and friends of George Floyd and the countless others who have suffered similar failures of justice:,unfolded suffered 
trust,5.0,2.5869999999999997,i have seen some white people post legit PowerPoints for their friends' bday stories on Instagram and now they can not be bothered to share useful #BlackLivesMatter links and resources.,seen post bothered share 
trust,9.0,4.745,Strong words because these are strong feelings. THANK YOU for organizing this powerful protest Everybody continue to post and share your words to inspire others and keep this change alive. FIGHT FIGHT FIGHT. #WVUNAACP #BlackLivesMatter Video by:,thank organizing continue post share inspire keep fight 
trust,4.0,2.218,Yesterday was one of the best protest i have seen since we started doing that. Unfortunately it only takes one bad apple in the police force to fire a weapon on peaceful protest. Hopefully these officers get disciplined smh Song by #BlackLivesMatter – at RICHMOND VA,seen started doing takes fire disciplined 
trust,5.0,2.508,Demonstrators chant #BlackLivesMatter as crowds grow at barricades outside the White House. DC Police in riot gear on other side of fence. #JusticeForGeorgeFloyd – at Lafayette Square Park,chant grow 
trust,6.0,3.273,"This is 11yo Jeremiah Badgett, who said he convinced his parents to come to the protests ""because of George Floyd."" When asked what he hopes happens as a result of the protests, he said: ""The police officer gets arrested."" – at St. john is Church, Lafayette Square",said convinced come asked hopes happens said arrested 
trust,4.0,2.5620000000000003,You can recognize that the four officers who knelt on George Floyd need to be prosecuted without accepting the underlying premise that our law enforcement is systemically racist. The data say it is isn't.,recognize knelt need prosecuted accepting say 
trust,6.0,3.0789999999999997,"Polls are open until 8pm. tonight is curfew does not apply to voting. At 7pm, when curfew starts, we invite everyone who is still in line to vote to take a knee in memory of #GeorgeFloyd and in solidarity with the movement for justice.",apply starts invite vote take 
trust,5.0,2.523,"Good evening from the nation is capital, where a huge crowd of peaceful demonstrators is marching down Pennsylvania Avenue toward Capitol Hill. i will be covering the #GeorgeFloyd protest here in Washington, D.C. for the evening. Follow this thread for updates.",marching covering follow 
trust,4.0,2.025,Just stood at 9th and Broad for about 15 minutes. Constant stream of a crowd this size for the entire time. and other elected leaders showed and marched with protestors in #RVA #GeorgeFloyd,stood elected showed marched 
trust,7.0,3.383,"In Philadelphia, that begins with City Council rejecting Mayor kenney is $14 million budget increase for the police department, and diverting those funds to critical city services like education for our young people. #BlackLivesMatter #EndPoliceBrutality #JusticeForGeorgeFloyd",begins rejecting diverting 
trust,4.0,2.2569999999999997,"Peaceful Protest in Lansdale, PA! Justice will be served....do not fight fire with fire. Be like the members of the Lansdale community! #BlackLivesMatter",served fight 
trust,6.0,2.7489999999999997,"Peaceful protest continues outside the White House, as police keep their distance and demonstrators listen and chant with a man who has climbed the street lamp near St. john is Church. Such a stark contrast from last night. #GeorgeFloyd – at Lafayette Square Park",continues keep listen chant climbed 
trust,6.0,3.1170000000000004,Joined neighbors waiting to vote in taking a knee at 7:00pm — the time of tonight is curfew — in solidarity. let is vote and create a city that works for all of us. #BlackLivesMatter – at Emery Recreation Center,joined waiting vote taking let vote create works 
trust,6.0,3.1260000000000003,"From this location defining moments in Black history have happened: Marian anderson is concert, mlk is speech, obama is inauguration celebration. This horrifying, intimidating image is an affront to American civil rights and social justice. #BlackLivesMatter #Resist #DCPROTEST",defining happened 
trust,4.0,2.4219999999999997,"Ameer my brother! Proud to be next to you, next with your people, next with our people, next to my people! We the People! Respect to each other! Never wasting peoples lives but empowering people! #BlackLivesMatter Proud of you!",respect wasting empowering matter 
trust,5.0,3.1090000000000004,"Ameer, brother! let is hope we find it! Each gesture of empathy, of love, is an antidote....watching the love that thousands of people across USA give everyday, like you, feeding Americans in need...we need a explosion of empathy! let is do it...#BlackLivesMatter",let hope find watching give feeding need let do 
trust,4.0,2.0700000000000003,i have seen players like Dhamir Cosby-Roundtree Sam Sessoms Donovan Rodriguez Tymair Johnson partaking in peaceful protests. They understand this is all bigger than #BlackLivesMatter #GeorgeFloydProtests,seen partaking understand 
trust,5.0,3.0469999999999997,DC Stand Up! Tomorrow we march and lay our bodies on the line in solidarity with millions of people across the world to demand justice and accountability for the countless Black and Brown bodies at the dispose of law enforcement. #BlackLivesMatter #SayTheirNames #DCProtest,stand lay demand say 
trust,6.0,3.462,"MY CITY !!! honestly jus so proud and happy , thank you all for coming out and showing nothing but support for BLACK LIVES ! they WILL receive the justice and equality they DESERVE! WE NOT STOPPIN #BlackLivesMatter #protests2020",thank coming showing receive deserve 
trust,6.0,2.805,"The invite for today is #BlackLivesMatter #Maryland: ""Tips for White People Attending: this is not your protest, you are there to listen, support, and, if necessary, be a barrier between instigators and your black neighbors. Use your privilege for good"" #GeorgeFloydProtests – at Main Street Tower",attending listen support use 
trust,4.0,2.6489999999999996,"The murder of #GeorgeFloyd has sparked a new wave of protests. it is our moral responsibility to fan the flames until we get real systemic change. CHECK YOUR REPS! Hold them accountable for their voting records. If they do not care about Black lives, VOTE THEM OUT!",sparked fan get check hold care vote 
trust,4.0,2.468,This is mostly very good and completely accurate but even Charlie Feels the need to convict the police in the George Floyd death before that case has been proven.,feels convict proven 
trust,4.0,2.141,"Proud to work with such a strong leader in and of the vulnerability shown by our staff today. We are not even close, but today we listened, learned, and lifted people up. Now the job is to not let it stop. #blacklivesmatter",work shown listened learned lifted let stop 
trust,5.0,2.9850000000000003,"ALL BLACK LIVES MATTER. Together we are STRONGER! No justice, no peace. Proud of the Temple and Philadelphia Community coming together today for a PEACEFUL protest! Racism and injustice can not exist and we can not stop this fight.",matter coming exist stop 
trust,8.0,3.898,"NEW — Unmarked Officers guarding White House: DC Code requires District personnel policing First Amendment assemblies to be equipped with ""enhanced identification"" badges. That rule does NOT apply to federal law enforcement officers. #GeorgeFloyd",guarding requires policing equipped enhanced apply 
trust,8.0,3.898,"NEW — Unmarked Officers guarding White House: DC Code requires District personnel policing First Amendment assemblies to be equipped with ""enhanced identification"" badges. That rule does NOT apply to federal law enforcement officers. #GeorgeFloyd",guarding requires policing equipped enhanced apply 
trust,5.0,2.507,Remarkable visual in the nation is capital this evening. Hundreds of peaceful demonstrators kneel on 16th Street as military vehicles and law enforcement form the newest layer of barricade distancing the White House from the #GeorgeFloyd protests.,kneel form distancing 
trust,6.0,2.96,"The peaceful protesters arrive at the US Capitol. They hold signs that read, ""Black Lives Matter,"" & ""I Can't Breathe."" Some tell me they want Congress to take action against police brutality in response to George floyd is death. Photo edited with filter. – at United States Capitol",arrive hold read breathe tell want take edited 
trust,6.0,2.968,"#GeorgeFloyd protest outside the White House remains peaceful, with demonstrators periodically standing and kneeling. it is 90 degrees here i have spotted FBI, National Guard, DC Police and various other unmarked federal and military law enforcement.",remains standing kneeling spotted 
trust,5.0,2.523,#BLACKBILIVESMATTER #BLACKFLUIDLIVESMATTER #BLACKTRANSLIVESMATTER follow my second art account queer_stoner_ on ig for more content like this! #BLM #BlackLivesMatter,follow 
trust,6.0,2.983,"At the Justice for Black Lives Car Rally. i am here in solidarity, i am here to listen—and i am going to keep working toward meaningful police reform in Congress. #BlackLivesMatter – at Fairfax County Government Center",listen—and going keep working 
trust,4.0,2.492,I commend ODU for always stepping up for the black community whether it is a time of crisis or not. This university deserves the utmost respect and praise. And shout out to the student who painted this on the rock. #BlackLivesMatter,commend stepping deserves shout painted 
trust,4.0,2.063,More powerful conversations being had today. I am so proud to be a part of this organization! Thank you for opening the door for for us for keeping the conversation going! #proudally #StrongerTogether #speakup #BlackLivesMatter,had thank opening keeping going 
trust,7.0,3.2039999999999997,"""White people, the best way to show us that Black Lives Matter is to use your privilege to call out your family friends for racial slurs."" This Fairfax NAACP rally gave specific marching orders. Our local group looks forward to working hard w/ #ENOUGH – at Fairfax County Government Center",show is use call gave looks working 
trust,7.0,3.343,"Another remarkable visual: Peaceful #GeorgeFloyd demonstrators here outside the White House are now sitting, phone lights on, singing ""Lean On Me"" — all while military and federal police stand in front of military vehicles guarding the White House.",sitting singing lean stand guarding 
trust,6.0,2.781,"An image for the history books: Peaceful protestors sing ""Lean On Me"" as federal and military police look on, standing guard in front of military vehicles parked in front of the White House. #GeorgeFloyd",sing look standing parked 
trust,6.0,3.0069999999999997,"My team and I are heading out, but the peaceful #GeorgeFloyd protest is still going strong outside the White House. Curfew in the nation is capital is 11pm ET, so we will see what happens when that time comes. But last night, protestors stayed long past the 7pm curfew.",heading going see happens comes stayed 
trust,5.0,2.46,It sure feels like DC is under federal occupation to crush peaceful protests. Here is an endless stream of what look to be active duty Military Police mixed in with National Guard. #BlackLivesMatter #BlackLivesMatterDC #DCProtests #– at Lafayette Square Park,feels crush look mixed 
trust,4.0,2.43,"""We can not stop, even after the convictions. Until the laws actually change, we can not stop."" #JusticeForGeorgeFloyd #BlackLivesMatter #DcProtests – at United States Capitol",stop change stop 
trust,7.0,3.397,"Join in solidarity with those protesting white supremacy & police brutality. We will kneel on Friday, June 5 for 8 min & 46 seconds exactly how long a police officer kneeled on George floyd is neck on the green outside of Presbyterian Hospital. #whitecoats4blacklives",join protesting kneel kneeled 
trust,5.0,2.7760000000000002,Just how i am feeling. Feel free to share if you would like #WeNotMe #CommunityStrongerTogether #ICantBreath #BlackLivesMatter #BLM #RightandWrong #GoodvsEvil #Philly #JusticeforGeorgeFloyd #justiceforahmaud #justiceforbreonnataylor #justiceforall #JUSTICE,feeling feel share like 
trust,6.0,3.102,"Joining local advocacy groups to call on police & law enforcement to protect protestors from COVID-19 including not using tear gas & mace, wearing masks, and kettling & other confinement tactics. #JusticeForGeorgeFloyd #BlackLivesMatter #8CantWait",joining call protect including using wearing 
trust,6.0,3.133,"This is what the media is not showing you: peaceful, community-based protests spreading love and awareness. If you live in Carroll County, please stop by the Westminster Library on Main Street from 3pm to sundown to show your support and/or bring donations! #BlackLivesMatter",showing based spreading live stop show bring 
trust,4.0,2.227,"A snapshot of what is going on currently in my birthstate and my town I grew up in of Old Bridge, New Jersey, USA. My father sent these to me as he was headed out to work! Told me he was very proud to witness this! — have at it! #GeorgeFloyd #JerseyStrong",going grew sent headed work told witness have 
trust,5.0,2.407,"does not represent the majority Commissioners, county government or the vast majority of #MontcoPA citizens. Elected officials have a higher standard in speech to the community we serve. #BlackLivesMatter",represent elected have serve 
trust,4.0,1.962,Falls Church teens organized a Black Lives Matter Unity Walk in the neighborhood around West End Park. Thousands showed up for the walk. #BLM #GeorgeFloydProtests,organized showed 
trust,8.0,4.462,"I HATE the world today. and I have raised our kids to love everyone regardless of race, sexual orientation, religion or anything. Yet i am losing followers/friends because I do not speak up one way or another. I am a strong advocate for #BlackLivesMatter, so don't",hate raised love losing speak 
trust,4.0,2.077,"Good one Amy... letting Keith clean up your mess? Those are pretty high charges AG. What happens when the DA can not prove that Officer Chauvin ""INTENTIONALLY"" murdered George Floyd? You must have some pretty hard evidence... or are you trying to appease the rioters? Risky move...",letting clean happens prove murdered have trying appease 
trust,5.0,2.281,"TONIGHT: ""disgusting"" and ""disappointing"" is how Mayor Helfrich describes the allegations into one of his police officers. York City patrol officer Clayton Swartz was placed on administrative leave with pay, after allegedly mocking the death of George Floyd at a party.",is describes placed mocking 
trust,4.0,2.773,": Susan Walsh / apnews Powerful: United States Senators pausing for 8 minutes, 46 seconds in the US Capital in honor of #GeorgeFloyd. #JusticeForGeorgeFloyd #BlackLivesMatter #GetOffOurNecks #Repost from msnbc…",pausing 
trust,4.0,2.093,"""The...killing of George Floyd and the outpouring of grief and righteous protests across the nation have highlighted...the founding vision of the United States...remains unrealized in this 21st century."" Our ceo is full statement here:",highlighted remains unrealized 
