sentiment,sentiment_count,sentiment_score,tweet_text,tweet_text_tmp
trust,5.0,2.969,"""Repairing the deep, historical, and continuing harm done to black people will require deep, abiding transformations....To fulfill the promise that black lives matter, the United States must change in systemic and not superficial ways.""",repairing continuing done require fulfill matter change 
trust,5.0,2.571,"A very important analysis and wake-up call for the church. Do ‘Black lives matter less'? Our collective behaviour and lack of positive action to the contrary would suggest so, according to the research by",do suggest according 
trust,4.0,1.97,"Sadly, in the eyes of the Democrat party, black conservatives dont count. Not ALL black lives matter to them. Black conservatives are the most politically courageous demographic there is given that an entire political party does not count them in their identity political base",count given count 
trust,3.0,2.149,". killed George Floyd on video with excessive force. So much for ""Trust, Accountability, and Professional Service""",killed 
trust,5.0,2.8989999999999996,"I pray for our world in the midst of a pandemic where we need masks to walk outside our homes. I pray for my fellow black people that live in fear of becoming a #and another innocent life taken I pray for change, safety& justice #AmyCooper #BlackLivesMatter #RIPGeorgeFloyd",pray need walk pray live becoming taken pray 
trust,6.0,2.798,"Local cops in Delaware wear blue lives matter toboggans when it is cold out. So that goes to show you the police themselves do not give a fuck about the black lives matter movement. In fact, they hate that shit.",wear matter goes show give hate 
trust,4.0,2.391,"With the murder of George Floyd, I want to remind Virginians of the Va justice app from Va ACLU. If you ever find yourself in a situation as a witness or victim, you can film and have it auto upload to their cloud so police can not destroy evidence from your phone. Be vigilant",want remind find film have destroy 
trust,5.0,2.156,"The latest videos, which show police pulling George Floyd from his car and dragging him around, serve as further evidence that not only was he not ""resisting arrest,"" but those who took his life were the ones who treated him like an object from the start",show pulling dragging serve resisting took treated 
trust,4.0,2.4290000000000003,Thanks Mr. Williams for bearing witness about your attempt to save life of #GeorgeFloyd! Your bravery and Heart speaks volumes about the strength of Black men for Black people in America! calling for prosecution of officer for murder on,bearing save speaks calling 
trust,5.0,2.992,"When irresponsible Muslims kill innocent people, we hear ALL Muslims, especially Imams, need to speak up or hold a million-man march condemning it. Agreed! I hope someone would tell police to do a million man march condemning killing of #GeorgeFloyd #BlackLivesMatter",kill hear need speak hold condemning agreed hope tell do condemning killing 
trust,6.0,3.265,Our music is to Uplift Nations and shame on you if your not putting God 1st!! Justice for George Floyd!! #BlackLivesMatter #georgefloyd Salute #shattamovement #Beatboppermusic,is uplift putting 
trust,5.0,2.6950000000000003,This is not a time to be silent. Advocate to make a difference in your life. Keep others accountable for their actions. Black citizens are suffering from ignorance of others and lack of privilege Black lives matter Black souls matter Black success matters Black happiness matters,make keep suffering matter matter 
trust,4.0,2.0469999999999997,"Our music is for ALL NATIONS!! Shoutout to ""We Making History for All To Stand Up and Unite!!"" Some of you-it May not being your time..but it is Shatta Wale Time right now!! And when it is your turn-we will bless you too!! Blessed up to the #SM team!! #GeorgeFloyd",making stand unite bless blessed 
trust,7.0,3.696,"Black Heterosexual Community, Pay attention to how Black LGBTQIA+ people are supporting justice for the loss of life of an innocent straight Black man. Start reciprocating that when it comes to the bullying and murders of Black Trans and Gay Folk. #BlackLivesMatter #GeorgeFloyd",pay supporting start reciprocating comes 
trust,5.0,3.071,"Praying for the health and safe release of my friend/former player and his crew. Murdering George Floyd is un-American; arresting media members who are doing their job and asking for guidance on how to comply is un-American. Tweeting to shoot looters, smdh...",praying murdering arresting doing asking comply tweeting shoot 
trust,6.0,3.337,"The USA needs a national dialogue on race, gender and class. A national Truth and Conciliation Commission on par with the TRCs of ZA, RW & CA. We do not just need justice for #GeorgeFloyd, we need justice for 244 years of institutionalized white supremacy. #AllThePeople",needs need need institutionalized 
trust,6.0,3.5469999999999997,"""He would just keep us safe there... at the end of the night, he would say ‘Hey Luz, i am gonna wait until you get into your cab.'"" Said by a friend who knew George Floyd when he was a restaurant security guard. Another said he loved making people smile.",keep say gon wait get said knew said loved making 
trust,6.0,3.7039999999999997,To all my friends going out to protest today. Y'all please be safe if you need anything that i can provide from here please call me. Fight for what is right but remember there are people that love you and would you alive to see the change you are helping create #BlackLivesMatter,going protest need provide call fight remember are love see helping create 
trust,4.0,2.696,"I will forever love the advocacy work that does, not only for dark skin women but for black people. FN has gainned so much from the Black Community that they can not remain silent during this time. This is the true definition of an INFLUENCER #BLM #GeorgeFloyd",love gainned remain 
trust,6.0,3.562,"Do you agree with the following Statement? Derek Chauvin, the police officer charged in the death of George Floyd, should be presumed innocent until proven guilty.",agree following charged presumed proven 
trust,6.0,3.4330000000000003,"""The very soul of America is at stake. We must commit as a nation to pursue justice with every once of our being with real urgency."" Thank you, for speaking to the pain so many are feeling right now. This is the leadership compassion our families need. #GeorgeFloyd",commit pursue thank speaking feeling need 
trust,7.0,3.992,"The only people who can get real justice for George Floyd are the 12 future members of the cops' jury. Our justice system is far from perfect, but it is the fairest that man has yet devised. It certainly delivers more justice than burning and stealing the property of innocents.",get devised delivers burning stealing 
trust,4.0,1.962,"Just to follow up on this, a White House cop gave a protestor a concussion. They carried him away while we all chased after them. WE DEMAND JUSTICE. WHAT BETTER PLACE TO DO IT THAN doorstep. #dcprotest #blacklivesmatter",follow gave carried chased demand do 
trust,6.0,3.321,"Protest is growing outside the White House. Protesters chant, ""Black Lives Matter, ""No Justice, No Peace."" they are outraged over the deaths of George Floyd, Breonna Taylor and other unarmed African Americans in the United States. #GeorgeFloyd #BreonnaTaylor – at The White House",growing outraged 
trust,5.0,2.071,NOW: A woman just climbed over the barrier outside the White House. Secret service officers took her into custody. Some protesters tell me Trump has not shown leadership over race relations in America. they are angry over deaths: #GeorgeFloyd #BreonnaTaylor. – at The White House,climbed took tell shown 
trust,5.0,2.6180000000000003,"Manifestantes frente a la Casa Blanca gritando: ""I can not breathe"" ""White silence is violence"" ""No justice, no peace, no racist police"" #BlackLivesMatter #GeorgeFloyd – at The White House",breathe 
trust,4.0,2.219,"Taking the cue from Please, please, my non-Black brothers and sisters. Don't say ‘Black Lives Matter' if you are not ALSO going to push for reparations for those of us who descend from US chattel slavery. And do not say, ""But how are going to do it?"" #JusticeForGeorge",taking say going push descend say going do 
trust,4.0,2.335,"The CNN reporter who was arrested is now saying his mother thought he would end up like George Floyd. i am no supporter of his arrest, but this is so incredibly dramatic and absurd and CNN should be ashamed of themselves.",arrested saying thought end 
trust,5.0,2.594,before i go to sleep i have a couple more things to say. BURN THIS SHIT DOWN. FUCK THE POLICE. ABOLISH THE POLICE. BLACK LIVES MATTER. BLACK TRANS LIVES MATTER. NO JUSTICE NO FUCKING PEACE. PERIOD.,go have say burn fuck abolish 
trust,4.0,2.1180000000000003,Lawyers offering free legal services for protesters arrested in many cities. Share widely! RT! #GeorgeFloyd #BlackLivesMatter #AtlantaProtest #chicagoprotest #Minneapolisprotests #dcprotest #nycprotests #riots2020,offering arrested share #riots 
trust,4.0,2.3200000000000003,"D.C. Police Chief Peter Newsham says the officers' actions were ""nothing short of murder"" — echoing law enforcement leaders nationwide who were unusually quick to denounce the use of force and side with activists: #GeorgeFloyd",says echoing denounce 
trust,4.0,2.32,"Most #police officers are having amazing restraint at protests. it is clear they were told not to initiate. it is clear they can deescelate have restraint. In fact, they do it regularly with Whites. If police had the same restraint with Blacks, #GeorgeFloyd would still be alive.",having told initiate have do had 
trust,4.0,1.984,"it is absolutely wild how many people including me, found out about Tulsa through THE FUCKING WATCHMEN TV SHOW. Rewrite all school history textbooks, the next edition better be a fucking good one #blacklivesmatter",including found fucking rewrite fucking 
trust,4.0,2.109,Need Justice for George Floyd! No one should ever be judged by any skin color! I have and had the privelage of being the athletic trainer for many men of color and I would do anything to protect or fight for these great young men! All men are created equal!!,need judged have had do protect fight created 
trust,3.0,2.148,"Live Drone Footage recorded by me of a peaceful protest in Newark, NJ . Protesting for George Floyd and justice to the men responsible. We are protesting for all lives lost due to racism and inequality – at Newark City Hall",recorded protesting protesting lost 
trust,5.0,3.0239999999999996,"No justice. No peace. BLACK LIVES MATTER. Today in Morgantown, W.V. we had a peaceful protest to support the #BlackLivesMatter movement thankful for everyone who came out and shared their voice",had support came shared 
trust,5.0,3.3120000000000003,I love these young people who are doing what we did years ago. They refuse to be distracted or seduced by the illusions of freedom. Stay focused and stay strong. God bless and protect all of the protestors. #georgefloyd #protest #activism,love doing did refuse distracted seduced stay focused stay bless protect 
trust,5.0,2.437,"Breaking: Harrisburg is officially under lockdown, with West Shore Fire and Camp Hill Fire Department told to close bridges to the city on the Cumberland County side, according to a Fire Calls Facebook post. This comes after a peaceful ""Black Lives Matter"" protest took a turn.",breaking told close according comes took 
trust,4.0,2.3669999999999995,"Holding a vigil for #GeorgeFloyd in SI at the site where the last words of #EricGarner, like floyd is, were #ICantBreathe. Gwen Carr, Korey Wise, Senator Benjamin, John Liu, local electeds, activists, and more united to demand justice. #WeCantBreathe",holding demand 
trust,6.0,2.665,"Where is Joel Osteenn and the other White mega-Church pastors? They say every life matters when it comes to abortion, but when is the last time they stood in the pulpit and said with no hesitation that ""Black Lives Matter""?! They don't, but you all go every Sunday and pay tithes.",say matters comes stood said go pay 
trust,3.0,2.04,Thank you to all those who came out as we honored the life of #GeorgeFloyd at the site of #EricGarner death where he uttered those same words: #ICantBreathe : Staten Island Advance – at Staten Island,thank came honored uttered 
trust,4.0,2.3120000000000003,"Today on May 30,2020, history was made in Newark, NJ as hundreds of people gathered PEACEFULLY to protest against the murder of George Floyd to promote justice and solidarity throughout this nation. I am so proud of us for taking a step towards change! We did this!!!",made gathered protest promote taking did 
trust,4.0,2.4610000000000003,"Chief Boone holds a Black Lives Matter sign today, supporting protestors calling for justice. Boone recently called for the arrests of all 4 officers involved in #GeorgeFloyd death, saying: ""What I saw was simply murder"" #13NewsNow",holds supporting calling called involved saying saw 
trust,3.0,2.157,i am live right now for a community discussion with and other local leaders to honor George Floyd and discuss what reforms are needed. Tune in for this important conversation about what we can do together to fight injustice.,live honor discuss needed tune do fight 
trust,6.0,3.836,"Some truths: George Floyd should be alive. Peaceful protest is a constitutional right. Anarchists pollute peaceful protests. Law order must be upheld. Arson theft are illegal—so is murder. We can hold all these things as truths at the same time, seek justice.",pollute upheld hold seek 
trust,4.0,2.479,"I understand the pain that people are feeling. We support the right of peaceful protestors, and we hear their pleas. But what we are now seeing on the streets of our cities has nothing to do with justice or peace. The memory of George Floyd is being dishonored...",understand feeling support hear seeing has do dishonored 
trust,4.0,2.0010000000000003,Respect existence or expect resistance on IG #BLACK_LIVES_MATTER,expect 
trust,7.0,3.8360000000000003,"Today, I witnessed the good in humanity. Black Lives Matters march in downtown Charlottesville, VA. Ninety percent of crowd, maybe more, good white people standing up for their fellow African American brothers and sisters. I was moved to tears! #BlackLivesMatter #SocialJustice",witnessed standing moved 
trust,4.0,2.039,Outside the Baltimore police department. Peaceful and not rioting. The cops are visibly scared! it is working #BlackLivesMatter #BaltimoreProtest,working 
trust,4.0,2.0709999999999997,. stop attacking and start trying to bring people together! invite family members of #BlackLivesMatter invite AfroAmerican leaders! Listen! They Want to be heard! Start a National conversation with Police+Black leaders! Now! #EmpathyDay,stop attacking start trying bring invite invite listen want heard start 
trust,5.0,2.8369999999999997,"A crowd prays at I.C. Norcom High School in Portsmouth before marching down High Street and protesting in response to the death of George Floyd. Chants of ""no justice, no peace"" and ""I can not breathe."" Signs read ""Justice for George Floyd"" and ""Black Lives Matter.""",prays marching protesting breathe read 
trust,4.0,2.602,"Chief Scott Schubert: ""i am just so angry at the fact that some segment hijacked this, and then took some of the youth and brought them into the mix."" Says police will review every video they can, use tech to identify/prosecute those responsible. #pittsburghprotest #GeorgeFloyd – at Pittsburgh Police Headquarters",hijacked took brought says review use identify prosecute 
trust,4.0,2.384,"Black Lives Matter, any questions? Join me and others who will share our TRUTHS. What can I do? Follow our lead.",join share do follow 
trust,4.0,2.617,"The FBI & U.S. Justice Dept. are working with local officials re: #pittsburghprotest They vow that any offenders who are from out of state caused damage/violence today will be charged federally, says #Pittsburgh Public Safety Director Wendell Hissrich. #GeorgeFloyd",working vow caused charged says 
trust,4.0,2.2419999999999995,FUCK THE POLICE! No Justice No Peace #BlackLivesMatters #GeorgeFloyd #CopCarOnFire #Philly,fuck 
trust,4.0,1.954,I apologize for my ignorance as i will never understand fully what a black man or woman will go through. But I will stand with you all #BlackLivesMatter #NoJusticeNoPeace #NoRacistPolice #STANDUP – at Wilmington Police Department,apologize understand go stand 
trust,4.0,2.032,"Snipers stand guard over the racist coward in the White House as the #BlackLivesMatter flag waves below. America, 2020. #GeorgeFloydProtests #JusticeForGeorge #NoJusticeNoPeace",stand guard waves 
trust,5.0,2.7489999999999997,"HAPPENING NOW: peaceful protest in Center City Allentown, PA met with officers batons at the ready to ""protect"" their police station. ""Hands up, DON'T SHOOT"" #BlackLivesMatter #protests #GeorgeFloydWasMurdered",happening met protect shoot 
trust,4.0,2.4219999999999997,"Our program is committed in continual work, discussions, & action 2 support our black student-athletes & all POC in Thanks to for your voice action. We are resolute in gathering growing more people 2 fight 4 justice. #RiaseHigh #blacklivesmatter",committed support gathering growing 
trust,4.0,2.1340000000000003,"i am so proud of ABE, everyone showed out today loud and proud!! that is the community support I love to see. & s/o to the organizers #BlackLivesMatter",showed love see s/o 
trust,4.0,2.6639999999999997,To all my friends TO ANYONE Out there protesting tonight Be safe Keep an eye on eachother And fuck the police I love you all #BlackLivesmatter,protesting keep fuck love 
trust,4.0,2.29,"""Injustice anywhere is a threat to justice everywhere."" -Martin Luther King, Jr. A statement from Head Coach Carla Berube. #BlackLivesMatter #BeTheChange",
trust,4.0,2.133,Statues of Confederate Leaders were defaced during overnight protest- along with the United Daughters of the Confederacy headquarters. #Richmond is now under an 8 pm Curfew. #rva #GeorgeFloyd via,defaced 
trust,4.0,2.1180000000000003,"For those ""leaders"" who say #BlackLivesMatter, but also: -Underfund public schools -Militarize protect bad cops -Allow poor folks to live on the street or in squalor -Tax working people &gt; rate than the 1% -Work to keep those closest to the pain farthest from power. Miss me.",say protect allow live keep miss 
trust,7.0,3.508,"saying it again, in all caps: END ZERO TOLERANCE MANDATE BLACK HISTORY ETHNIC STUDIES HIRE MORE BLACK TEACHERS FUND COUNSELORS NOT COPS #fundschools #divestfromNYPD #NYCPROTEST #brooklynprotest #education #BlackLivesMatter #NYCSchools #NYCDOE #BLM",saying hire 
trust,4.0,2.274,i have had it.And i am calling people out. I have asked the people that have public shared statements about supporting Black Lives Matter to come and peacefully protest with me. And have been met with excuse after excuse. BUT I SEE YOU POST DRUNK VIDS being back at bars/restaurants,had calling asked have shared supporting come protest met see post 
trust,5.0,2.766,"Even in times of hurt, the people of Milwaukee are strong. let is continue to show up with love, be safe, and commit to a safer world for everyone. #BlackLivesMatter",hurt let continue show commit 
trust,4.0,2.2430000000000003,"I announced my independent POTUS campaign for #AllThePeople over a year ago with this video. I invite you to watch. It speaks directly as to why our Constitution, in its current form, is incapable of providing justice for the murder of #GeorgeFloyd.",announced invite watch speaks providing 
trust,4.0,1.9850000000000003,"Tiny town police chief issued this statement. it is so much better than I expected it to be. He actually says ""Black Lives Matter."" And I did not know the Dept was working with a cultural anthropologist. I know Abbie. She tolerates absolutely no bullshit.",issued expected be says know working know tolerates 
trust,4.0,2.407,BLACK LIVES MATTER IS NOT TAKING AWAY THE FACT THAT ALL LIVES MATTER. BLM IS SIMPLY HELPING OUT THE PEOPLE WHO FUCKING NEED IT. OBVIOUSLY EVERY human is LIFE MATTERS. BUT BLACK PEOPLE NEED THE LOVE MORE THAN EVER RIGHT NOW.,taking matter helping fucking need matters need 
trust,3.0,1.938,"BRIDGE CLOSED: The Benjamin Franklin Bridge has been closed until further notice, city officials say. Among the reasons: a planned march from the bridge to the Liberty Bell as a demonstration for justice for #GeorgeFloyd",closed say planned 
trust,7.0,3.969,"The protest and march is getting ready to begin. Organizers are working with police and are spreading messages of love. A racially diverse crowd is forming of socially distant, mask wearing, justice seeking friends. This is how it should be. #BlackLivesMatter #GeorgeFloyd – at Pier Village",getting begin working spreading forming seeking 
trust,5.0,2.782,"Here is the full 20 minute live stream regarding institutionalized white supremacy, the murder of #GeorgeFloyd and my vision for Truth and Conciliation.",regarding institutionalized 
trust,4.0,2.0860000000000003,i am raising awareness and funds for several Black Lives Matter organizations and black owned businesses affected by the protest. i have designed some shirts and 100% of the procceds will be donated. Please and like to spread awareness Purchase at:,raising owned affected designed donated like spread 
trust,4.0,2.249,"Standing in solidarity with the rest of the nation in unrest,demanding Justice for George Floyd. Tonight we will occupy the Virginia Beach Oceanfront. For far to long Virginia Beach police have harassed black &amp;…",standing demanding occupy harassed 
trust,5.0,2.36,We as a nation throughout all of history have failed the black community. We need to be better. We need to be better allys. We must end and eradicate white supremacy. We must listen and learn. #BlackLivesMatter #JusticeForGeorgeFloyd,failed need need end eradicate listen learn 
trust,3.0,1.961,"Our program stands in solidarity with the people who have to face the harsh realities of racism each and every day. We believe in the responsibility for each and every one of us to fight against racism and for justice, so peace can prevail. #RaiseHigh #BlackLivesMatter",stands have face believe fight prevail 
trust,4.0,2.383,"Yo legit, 2nd day of protest on Shaolin and it is peaceful as fuck. #StatenIsland making me proud for a once. #GeorgeFloydProtests #BlacklivesMatter #JusticeForGeorgeFloyd",making 
trust,6.0,3.113,Leaving the White House. It was an anxious feeling looking at snipers aimed at everyone out there. I hope everyone who stays out continues to be safe. #DCProtest #BlackLivesMatter – at The White House,leaving looking aimed hope stays continues 
trust,4.0,2.258,"Protesters at Philadelphia Police HQ, known as the Roundhouse, take a knee to honor George Floyd. Ask cops guarding building to do the same with chant of ""take a knee!""",known take honor ask guarding do take 
trust,5.0,3.2030000000000003,"#Minneapolis Police Chief Medaria Arradondo on why he fired the four officers involved immediately after #georgefloyd is death: ""This was a violation of humanity."" Important to notice that in similar cases in the past police officers thought responsible went on with their duties.",fired involved notice thought went 
trust,4.0,2.141,"happy pride month but do not lose focus on the movement going on. be gay, fight oppression. be gay, protest. be gay while supporting black lives matter. you have the range",lose going fight supporting have 
trust,4.0,2.251,"Sorry. I am a black mother. I deal with the reality of the FACT that we get KILLED because the cops said they THOUGHT we MIGHT have done something. #GeorgeFloyd Pick one that you can deal with: eating ice cream, sleeping, driving, jogging, BBQ'ing, or breathing. Each dead is fact",deal killed said thought done pick deal eating 
trust,6.0,3.603,"So many women on the frontlines, doing what they do: fiercely defending the peaceful nature of the protests against the threat of violence from police or agitators & showing love & compassion. #SheBuildsPeace #DCProtests #BlackLivesMatter",doing do defending showing 
trust,4.0,2.079,Do you agree with the following statement? I am more convinced than ever that black lives matter and that Amserica need to listen to the pain and frustration in the black community.,agree following matter need listen 
trust,8.0,4.4700000000000015,"We jam out to black music, we cheer and are impassioned by black athletes. We should be as passionate in embracing black struggles and fight to dismantle racial injustice. To not do so is to say you do not fully love black humanity and that to me is insulting. #BlackLivesMatter",jam cheer impassioned embracing fight dismantle do is say love 
trust,4.0,2.281,"I honestly do not feel like going about my business just yet. Today I will dedicate my page to raise awareness, because if we stay silent...then we are also part of the problem! #BlackLivesMatter #GeorgeFloyd #JusticeForGeorgeFloyd #ALLLIVESMATER #protests2020",feel going dedicate raise stay 
trust,5.0,2.6950000000000003,Quad Dance Team is proud to support the Black Lives Matter movement as we donate to assist with the representation and bail costs of protestors who have been incarcerated.,support donate assist incarcerated 
trust,8.0,4.579,"Powerful words of peace and unity spoken outside the Trenton Police Headquarters yesterday in the NJ Capital: ""we have to uphold our excellence and not go low because that is exactly where they want us"". #BlackLivesMatter #nj #Trenton",spoken have uphold go want 
trust,5.0,2.696,I just want the record to show that everyone with the #BlackLivesMatter organization in the protest were peaceful until the tear gas went out I got more pictures if you all need more proof #757blm #VirginiaBeach #oceanfront,want show went got need 
